{
  "az_step_deg": 2,
  "heights_m": [
    0.5,
    1,
    2,
    3,
    5
  ],
  "el_deg": [
    [
      1.565,
      1.617,
      1.66,
      1.696,
      1.724,
      1.745,
      1.758,
      1.764,
      1.764,
      1.758,
      1.748,
      1.734,
      1.717,
      1.698,
      1.678,
      1.657,
      1.637,
      1.619,
      1.602,
      1.588,
      1.577,
      1.569,
      1.565,
      1.565,
      1.569,
      1.577,
      1.588,
      1.602,
      1.619,
      1.637,
      1.657,
      1.678,
      1.698,
      1.717,
      1.734,
      1.748,
      1.758,
      1.764,
      1.764,
      1.758,
      1.745,
      1.724,
      1.696,
      1.66,
      1.617,
      1.565,
      1.505,
      1.438,
      1.364,
      1.283,
      1.197,
      1.107,
      1.013,
      0.916,
      0.818,
      0.72,
      0.623,
      0.528,
      0.437,
      0.352,
      0.272,
      0.199,
      0.135,
      0.08,
      0.035,
      0.001,
      -0.022,
      -0.034,
      -0.034,
      -0.022,
      0.001,
      0.035,
      0.08,
      0.135,
      0.199,
      0.272,
      0.352,
      0.437,
      0.528,
      0.623,
      0.72,
      0.818,
      0.916,
      1.013,
      1.107,
      1.197,
      1.283,
      1.364,
      1.438,
      1.505,
      1.565,
      1.617,
      1.66,
      1.696,
      1.724,
      1.745,
      1.758,
      1.764,
      1.764,
      1.758,
      1.748,
      1.734,
      1.717,
      1.698,
      1.678,
      1.657,
      1.637,
      1.619,
      1.602,
      1.588,
      1.577,
      1.569,
      1.565,
      1.565,
      1.569,
      1.577,
      1.588,
      1.602,
      1.619,
      1.637,
      1.657,
      1.678,
      1.698,
      1.717,
      1.734,
      1.748,
      1.758,
      1.764,
      1.764,
      1.758,
      1.745,
      1.724,
      1.696,
      1.66,
      1.617,
      1.565,
      1.505,
      1.438,
      1.364,
      1.283,
      1.197,
      1.107,
      1.013,
      0.916,
      0.818,
      0.72,
      0.623,
      0.528,
      0.437,
      0.352,
      0.272,
      0.199,
      0.135,
      0.08,
      0.035,
      0.001,
      -0.022,
      -0.034,
      -0.034,
      -0.022,
      0.001,
      0.035,
      0.08,
      0.135,
      0.199,
      0.272,
      0.352,
      0.437,
      0.528,
      0.623,
      0.72,
      0.818,
      0.916,
      1.013,
      1.107,
      1.197,
      1.283,
      1.364,
      1.438,
      1.505
    ],
    [
      1.55,
      1.602,
      1.646,
      1.682,
      1.71,
      1.73,
      1.743,
      1.749,
      1.749,
      1.744,
      1.734,
      1.72,
      1.703,
      1.684,
      1.663,
      1.643,
      1.623,
      1.604,
      1.587,
      1.573,
      1.562,
      1.554,
      1.55,
      1.55,
      1.554,
      1.562,
      1.573,
      1.587,
      1.604,
      1.623,
      1.643,
      1.663,
      1.684,
      1.703,
      1.72,
      1.734,
      1.744,
      1.749,
      1.749,
      1.743,
      1.73,
      1.71,
      1.682,
      1.646,
      1.602,
      1.55,
      1.49,
      1.423,
      1.349,
      1.269,
      1.183,
      1.092,
      0.998,
      0.901,
      0.803,
      0.705,
      0.608,
      0.514,
      0.423,
      0.337,
      0.257,
      0.185,
      0.121,
      0.066,
      0.021,
      -0.014,
      -0.037,
      -0.049,
      -0.049,
      -0.037,
      -0.014,
      0.021,
      0.066,
      0.121,
      0.185,
      0.257,
      0.337,
      0.423,
      0.514,
      0.608,
      0.705,
      0.803,
      0.901,
      0.998,
      1.092,
      1.183,
      1.269,
      1.349,
      1.423,
      1.49,
      1.55,
      1.602,
      1.646,
      1.682,
      1.71,
      1.73,
      1.743,
      1.749,
      1.749,
      1.744,
      1.734,
      1.72,
      1.703,
      1.684,
      1.663,
      1.643,
      1.623,
      1.604,
      1.587,
      1.573,
      1.562,
      1.554,
      1.55,
      1.55,
      1.554,
      1.562,
      1.573,
      1.587,
      1.604,
      1.623,
      1.643,
      1.663,
      1.684,
      1.703,
      1.72,
      1.734,
      1.744,
      1.749,
      1.749,
      1.743,
      1.73,
      1.71,
      1.682,
      1.646,
      1.602,
      1.55,
      1.49,
      1.423,
      1.349,
      1.269,
      1.183,
      1.092,
      0.998,
      0.901,
      0.803,
      0.705,
      0.608,
      0.514,
      0.423,
      0.337,
      0.257,
      0.185,
      0.121,
      0.066,
      0.021,
      -0.014,
      -0.037,
      -0.049,
      -0.049,
      -0.037,
      -0.014,
      0.021,
      0.066,
      0.121,
      0.185,
      0.257,
      0.337,
      0.423,
      0.514,
      0.608,
      0.705,
      0.803,
      0.901,
      0.998,
      1.092,
      1.183,
      1.269,
      1.349,
      1.423,
      1.49
    ],
    [
      1.529,
      1.581,
      1.625,
      1.661,
      1.689,
      1.709,
      1.722,
      1.729,
      1.729,
      1.723,
      1.713,
      1.699,
      1.682,
      1.663,
      1.643,
      1.622,
      1.602,
      1.583,
      1.567,
      1.552,
      1.541,
      1.534,
      1.53,
      1.53,
      1.534,
      1.541,
      1.552,
      1.567,
      1.583,
      1.602,
      1.622,
      1.643,
      1.663,
      1.682,
      1.699,
      1.713,
      1.723,
      1.729,
      1.729,
      1.722,
      1.709,
      1.689,
      1.661,
      1.625,
      1.581,
      1.529,
      1.47,
      1.402,
      1.328,
      1.248,
      1.162,
      1.072,
      0.977,
      0.881,
      0.783,
      0.685,
      0.588,
      0.493,
      0.402,
      0.316,
      0.236,
      0.164,
      0.1,
      0.045,
      0,
      -0.034,
      -0.058,
      -0.069,
      -0.069,
      -0.058,
      -0.034,
      0,
      0.045,
      0.1,
      0.164,
      0.236,
      0.316,
      0.402,
      0.493,
      0.588,
      0.685,
      0.783,
      0.881,
      0.977,
      1.072,
      1.162,
      1.248,
      1.328,
      1.402,
      1.47,
      1.529,
      1.581,
      1.625,
      1.661,
      1.689,
      1.709,
      1.722,
      1.729,
      1.729,
      1.723,
      1.713,
      1.699,
      1.682,
      1.663,
      1.643,
      1.622,
      1.602,
      1.583,
      1.567,
      1.552,
      1.541,
      1.534,
      1.53,
      1.53,
      1.534,
      1.541,
      1.552,
      1.567,
      1.583,
      1.602,
      1.622,
      1.643,
      1.663,
      1.682,
      1.699,
      1.713,
      1.723,
      1.729,
      1.729,
      1.722,
      1.709,
      1.689,
      1.661,
      1.625,
      1.581,
      1.529,
      1.47,
      1.402,
      1.328,
      1.248,
      1.162,
      1.072,
      0.977,
      0.881,
      0.783,
      0.685,
      0.588,
      0.493,
      0.402,
      0.316,
      0.236,
      0.164,
      0.1,
      0.045,
      0,
      -0.034,
      -0.058,
      -0.069,
      -0.069,
      -0.058,
      -0.034,
      0,
      0.045,
      0.1,
      0.164,
      0.236,
      0.316,
      0.402,
      0.493,
      0.588,
      0.685,
      0.783,
      0.881,
      0.977,
      1.072,
      1.162,
      1.248,
      1.328,
      1.402,
      1.47
    ],
    [
      1.513,
      1.565,
      1.609,
      1.645,
      1.673,
      1.693,
      1.706,
      1.713,
      1.713,
      1.707,
      1.697,
      1.683,
      1.666,
      1.647,
      1.627,
      1.606,
      1.586,
      1.567,
      1.551,
      1.536,
      1.525,
      1.518,
      1.514,
      1.514,
      1.518,
      1.525,
      1.536,
      1.551,
      1.567,
      1.586,
      1.606,
      1.627,
      1.647,
      1.666,
      1.683,
      1.697,
      1.707,
      1.713,
      1.713,
      1.706,
      1.693,
      1.673,
      1.645,
      1.609,
      1.565,
      1.513,
      1.454,
      1.387,
      1.312,
      1.232,
      1.146,
      1.056,
      0.961,
      0.865,
      0.767,
      0.669,
      0.572,
      0.477,
      0.386,
      0.3,
      0.221,
      0.148,
      0.084,
      0.029,
      -0.016,
      -0.05,
      -0.073,
      -0.085,
      -0.085,
      -0.073,
      -0.05,
      -0.016,
      0.029,
      0.084,
      0.148,
      0.221,
      0.3,
      0.386,
      0.477,
      0.572,
      0.669,
      0.767,
      0.865,
      0.961,
      1.056,
      1.146,
      1.232,
      1.312,
      1.387,
      1.454,
      1.513,
      1.565,
      1.609,
      1.645,
      1.673,
      1.693,
      1.706,
      1.713,
      1.713,
      1.707,
      1.697,
      1.683,
      1.666,
      1.647,
      1.627,
      1.606,
      1.586,
      1.567,
      1.551,
      1.536,
      1.525,
      1.518,
      1.514,
      1.514,
      1.518,
      1.525,
      1.536,
      1.551,
      1.567,
      1.586,
      1.606,
      1.627,
      1.647,
      1.666,
      1.683,
      1.697,
      1.707,
      1.713,
      1.713,
      1.706,
      1.693,
      1.673,
      1.645,
      1.609,
      1.565,
      1.513,
      1.454,
      1.387,
      1.312,
      1.232,
      1.146,
      1.056,
      0.961,
      0.865,
      0.767,
      0.669,
      0.572,
      0.477,
      0.386,
      0.3,
      0.221,
      0.148,
      0.084,
      0.029,
      -0.016,
      -0.05,
      -0.073,
      -0.085,
      -0.085,
      -0.073,
      -0.05,
      -0.016,
      0.029,
      0.084,
      0.148,
      0.221,
      0.3,
      0.386,
      0.477,
      0.572,
      0.669,
      0.767,
      0.865,
      0.961,
      1.056,
      1.146,
      1.232,
      1.312,
      1.387,
      1.454
    ],
    [
      1.488,
      1.54,
      1.584,
      1.62,
      1.648,
      1.668,
      1.681,
      1.687,
      1.687,
      1.682,
      1.672,
      1.658,
      1.641,
      1.622,
      1.602,
      1.581,
      1.561,
      1.542,
      1.525,
      1.511,
      1.5,
      1.493,
      1.489,
      1.489,
      1.493,
      1.5,
      1.511,
      1.525,
      1.542,
      1.561,
      1.581,
      1.602,
      1.622,
      1.641,
      1.658,
      1.672,
      1.682,
      1.687,
      1.687,
      1.681,